{
  "$schema": "../../../../schemas/agent-work-order.schema.json",
  "schema_version": "1.0.0",
  "workflow_version": "blueprint-cinema-1.0",
  "work_order_id": "hf90-frame-03",
  "episode_folder": "EP006-direct-booking-recovery",
  "role": "renderer_implementer",
  "objective": "Build the isolated native HyperFrames composition fragment for 03-loop-back from its hash-pinned frame packet and design tokens, without touching the comparison project or canonical episode state.",
  "required_gate": "greybox_ready",
  "inputs": [
    {
      "path": "episodes/EP006-direct-booking-recovery/input-lock.json",
      "sha256": "e99b847c5b5a767d74ad4208738374ac191da3d9d4c3e3654098a6c08e725691"
    },
    {
      "path": "experiments/EP006-90s-runtime-comparison/hyperframes/frame.md",
      "sha256": "47ff1980d56db086ab853f1870d69417e897974cf1ae2417bb21c518ed19fb87"
    },
    {
      "path": "experiments/EP006-90s-runtime-comparison/hyperframes/.hyperframes/frame-packets/_role.md",
      "sha256": "77fe0b832963442962c4fa138c5eb3d26178c67d0fdfcd7850a61ebd6cbe4353"
    },
    {
      "path": "experiments/EP006-90s-runtime-comparison/hyperframes/.hyperframes/frame-packets/03-loop-back.md",
      "sha256": "8929dfefc60a25780977fc9e23cbbe0a7f1ece5829ebc64cb628635d5eb0a018"
    }
  ],
  "owned_output_paths": [
    "episodes/EP006-direct-booking-recovery/agents/deliverables/hf90-frame-03/frame.html",
    "episodes/EP006-direct-booking-recovery/agents/deliverables/hf90-frame-03/deliverable.json"
  ],
  "forbidden_paths": [
    "episodes/EP006-direct-booking-recovery/episode.json",
    "episodes/EP006-direct-booking-recovery/input-lock.json",
    "episodes/EP006-direct-booking-recovery/production-state.json",
    "episodes/EP006-direct-booking-recovery/episode-engine.json",
    "episodes/EP006-direct-booking-recovery/world.json",
    "episodes/EP006-direct-booking-recovery/visual-plan.json",
    "episodes/EP006-direct-booking-recovery/asset-tickets.json",
    "src/",
    "schemas/",
    "renderer/src/Root.tsx",
    "renderer/src/index.ts",
    "experiments/EP006-90s-runtime-comparison/hyperframes/"
  ],
  "dependencies": [
    "current greybox_ready gate",
    "hash-pinned native HyperFrames frame packet",
    "serial root integration after packet validation"
  ],
  "time_range": {
    "in": 15.808,
    "out": 22.189
  },
  "acceptance_checks": [
    "Return one bare template fragment that implements every time-coded scene without front-loading",
    "Use only frame.md tokens and packet-defined invented visuals with deterministic seek-safe motion",
    "Keep all visible content above the 83 percent keep-out and do not render narration as captions",
    "Return a schema-valid deliverable without claiming approval or changing production state"
  ],
  "permissions": {
    "external_writes": false,
    "paid_services": false,
    "synthetic_generation": false,
    "canonical_state_changes": false
  },
  "retry_limit": 1,
  "stopping_conditions": [
    "Stop if any declared input hash differs from the work order",
    "Stop if implementation would require writing outside the isolated deliverable directory",
    "Stop rather than inventing a vendor logo interface evidence document or external media"
  ],
  "status": "closed"
}
